{
  "schemaVersion": 1,
  "project": "orca-strator",
  "developmentStatus": "READY_TO_IMPLEMENT",
  "highLevelGoal": "Build Orca-Strator through the committed V1 roadmap as far as safely possible, continuously advancing across OpenSpec changes without stopping at ordinary review checkpoints.",
  "activeMilestone": 2,
  "activeChange": "002-repository-watch-dispatch",
  "completedMilestones": [0, 1],
  "planningBaseSha": "b791aca22a6133be421919ba5ae02a8335f60bf5",
  "checkpoint": {
    "summary": "Milestone 1 control plane foundation and corrective hardening (001 and 001a) are completely implemented, verified (57 tests passing across shared/controller/desktop/ui, atomic migrations, robust WebSocket reconnect, browser deep-link history routing, tech baseline alignment with React 19.2/Vite 8.1/Tailwind 4.3/Vitest 4.1/Electron 43/Node 24, and clean-output builds), and folded into canonical openspec/specs/control-plane-foundation/. Milestone 2 (repository watcher and transactional dispatch) is now active.",
    "updatedAt": "2026-08-19T22:20:00+08:00",
    "lastCompletedTask": "Fold Milestone 1 control plane foundation into canonical specs and activate Milestone 2 OpenSpec",
    "lastVerification": "Full workspace clean typecheck, 57 vitest tests, production SPA/API smoke, and dev supervisor smoke verified successfully."
  },
  "nextAction": "Implement Milestone 2 (openspec/changes/002-repository-watch-dispatch): DispatchMarker protocol types/schemas in @orca/shared, SQLite migration 002 for dispatches and watcher_state, GitClient and CommitInspector in @orca/controller, WatcherService with remote main polling, REST/WebSocket watcher observability, and temporary bare Git remote integration tests.",
  "blockers": [],
  "developmentPolicies": {
    "branch": "main",
    "commitAndPush": true,
    "preserveDirtyWork": true,
    "forcePush": false,
    "significantWorkUsesOpenSpec": true,
    "sessionExitRequiresWaypointUpdate": true
  }
}
